md_file,slide_id,slide_title,need_image,image_type,query_cn,query_en,layout,reason,priority,avoid,source_preference,manual_review
第5章_深度学习多模态AI与显微组织识别_100页_Marp.md,125,本章重点公式回顾,no,,,,,该页已有表格，暂不插图,low,not needed,,no
第5章_深度学习多模态AI与显微组织识别_100页_Marp.md,126,编程作业：合成显微图像的分类,no,,,,,小结或作业页不建议插图,low,not needed,,no
第5章_深度学习多模态AI与显微组织识别_100页_Marp.md,127,作业参考代码框架：生成图像,no,,,,,该页为代码页，插图会造成拥挤,low,not needed,,no
第5章_深度学习多模态AI与显微组织识别_100页_Marp.md,128,作业参考代码框架：构造数据集,no,,,,,该页为代码页，插图会造成拥挤,low,not needed,,no
第5章_深度学习多模态AI与显微组织识别_100页_Marp.md,129,作业提交要求,no,,,,,小结或作业页不建议插图,low,not needed,,no
第5章_深度学习多模态AI与显微组织识别_100页_Marp.md,130,思考题,no,,,,,小结或作业页不建议插图,low,not needed,,no
第5章_深度学习多模态AI与显微组织识别_100页_Marp.md,131,参考资料与延伸阅读,no,,,,,小结或作业页不建议插图,low,not needed,,no
第5章_深度学习多模态AI与显微组织识别_100页_Marp.md,132,结束页,no,,,,,小结或作业页不建议插图,low,not needed,,no
